{
  "schema_version": "test-artifacts.v1",
  "contract_version": "evidence-contract.v1",
  "run_id": "20260604-122932",
  "generated_at": "2026-06-04T12:29:32.741148+00:00",
  "generator": {
    "name": "artifact-registry-emitter",
    "version": "v1"
  },
  "root_dir": "results\/test-artifacts",
  "run_manifest": {
    "path": "results\/test-artifacts\/test-run.json",
    "schema_version": "test-run.v1",
    "sha256": "1c139e3ba6f79bd799ca1aa3fbe7c9897d8465df8c303019dbe4e38b0c1bfbff",
    "bytes": 2187,
    "mtime_utc": "2026-06-04T12:29:32.841836+00:00"
  },
  "artifacts": [
    {
      "path": "results\/test-artifacts\/test-summary.json",
      "producer": "summary-emitter.v1",
      "schema_version": "test-summary.v2",
      "verifies_against": [
        "test-run.v1",
        "projection.v1"
      ],
      "mtime_utc": "2026-06-04T12:29:32.841836+00:00",
      "input_versions": {
        "test_run": "test-run.v1",
        "projection": "projection.v1",
        "scenario": "scenario.v1"
      },
      "id": "test-summary",
      "kind": "summary",
      "bytes": 2075,
      "sha256": "96ab7a64c141df1bf95fec9daea69c4725981e80f860f5e912426ccfbc6ee7f5",
      "contract_version": "evidence-contract.v1"
    },
    {
      "path": "results\/test-artifacts\/test-run.json",
      "producer": "test-run-emitter.v1",
      "schema_version": "test-run.v1",
      "verifies_against": [],
      "mtime_utc": "2026-06-04T12:29:32.841836+00:00",
      "input_versions": {},
      "id": "test-run",
      "kind": "run-manifest",
      "bytes": 2187,
      "sha256": "1c139e3ba6f79bd799ca1aa3fbe7c9897d8465df8c303019dbe4e38b0c1bfbff",
      "contract_version": "evidence-contract.v1"
    },
    {
      "path": "results\/test-artifacts\/claimable-classification.json",
      "producer": "claimable-classification-emitter.v1",
      "schema_version": "claimable-classification.v1",
      "verifies_against": [
        "test-run.v1"
      ],
      "mtime_utc": "2026-06-04T12:29:32.841836+00:00",
      "input_versions": {
        "test_run": "test-run.v1"
      },
      "id": "claimable-classification",
      "kind": "classification",
      "bytes": 1160,
      "sha256": "c7a929d372b3b0ad51cdaee708aa35703595d527326af14aca6003692ba62792",
      "contract_version": "evidence-contract.v1"
    },
    {
      "path": "results\/evidence\/kleros-preemptive-escalation-rejected-l0.result.json",
      "producer": "evidence-build-emitter.v1",
      "schema_version": "scenario-result.v1",
      "verifies_against": [
        "test-run.v1"
      ],
      "mtime_utc": "2026-06-04T12:29:32.585827+00:00",
      "input_versions": {
        "test_run": "test-run.v1"
      },
      "id": "scenario-result",
      "kind": "scenario-result",
      "bytes": 71799,
      "sha256": "8fe65c9c94586cbdb87fb5c05aeb7a70d8b884f672bb00fb83fb82c739ad8b7d",
      "contract_version": "evidence-contract.v1"
    }
  ]
}